{
  "shape": "C-Purlins",
  "sectionName": "C10015",
  "areaCustom": 443,
  "moixCustom": 1610000,
  "moiyCustom": 237000,
  "zxCustom": 24500,
  "zyCustom": 5290,
  "d": 100,
  "b": 50,
  "l": 13.5,
  "t": 1.5,
  "custom": false,
  "Fy": 250,
  "E": 200000,
  "W": 7850,
  "deflection": 360,
  "L": 1,
  "s": 0.75,
  "a": 30,
  "x": "midpoint",
  "G": 2,
  "Ql": 1,
  "Qwi": 0,
  "Qwo": -3,
  "Qs": 0,
  "γ_Gj": 0.9,
  "Ψ_0": 0.7,
  "Ψ_1": 0.5,
  "Ψ_2": 0.3,
  "uid": "2303-purlins-calculator-en",
  "current_unit_system": "metric",
  "project_details": {
    "project_company": "",
    "project_name": "",
    "project_designer": "",
    "project_id": "",
    "project_client": "",
    "project_notes": ""
  }
}